{
  "schema_version": 2,
  "registry_id": "future-learning-datasets-v1",
  "owner": "d2i-learning-review-board",
  "reviewed_at_unix_seconds": 1785110400,
  "maximum_total_bytes": 107374182400,
  "datasets": [
    {
      "priority": 1,
      "dataset_id": "oasst2",
      "display_name": "OpenAssistant Conversations Dataset Release 2",
      "purpose": "multi_turn_conversation",
      "source_url": "https://huggingface.co/datasets/OpenAssistant/oasst2",
      "source_revision": "unresolved",
      "intended_uses": [
        "evaluation",
        "supervised_fine_tuning"
      ],
      "license": {
        "declared_spdx_expression": "Apache-2.0",
        "scope": "dataset_wide",
        "evidence_url": "https://huggingface.co/datasets/OpenAssistant/oasst2",
        "evidence_revision": "unresolved",
        "requires_attribution": true,
        "requires_share_alike": false,
        "attribution_plan_hash": null,
        "share_alike_plan_hash": null,
        "component_license_inventory_hash": null
      },
      "risk": {
        "contains_user_content": true,
        "contains_model_generated_content": true,
        "generation_system": "OpenAssistant mixed human and synthetic conversation collection",
        "requires_personal_data_review": true,
        "contains_sensitive_safety_content": true,
        "contains_third_party_content": false,
        "contains_executable_content": false,
        "contains_credentials_or_session_data": false,
        "source_notes": "Conversation trees include multilingual user content, rankings, moderation labels, and synthetic messages."
      },
      "reviews": {
        "legal": null,
        "provenance": null,
        "privacy": null,
        "security": null,
        "generation_terms": null
      },
      "artifacts": [],
      "status": "candidate"
    },
    {
      "priority": 2,
      "dataset_id": "super-natural-instructions",
      "display_name": "Super-NaturalInstructions",
      "purpose": "instruction_following",
      "source_url": "https://github.com/allenai/natural-instructions",
      "source_revision": "unresolved",
      "intended_uses": [
        "evaluation",
        "supervised_fine_tuning"
      ],
      "license": {
        "declared_spdx_expression": "NOASSERTION",
        "scope": "component_specific",
        "evidence_url": "https://github.com/allenai/natural-instructions#license",
        "evidence_revision": "unresolved",
        "requires_attribution": true,
        "requires_share_alike": false,
        "attribution_plan_hash": null,
        "share_alike_plan_hash": null,
        "component_license_inventory_hash": null
      },
      "risk": {
        "contains_user_content": true,
        "contains_model_generated_content": false,
        "generation_system": null,
        "requires_personal_data_review": true,
        "contains_sensitive_safety_content": false,
        "contains_third_party_content": true,
        "contains_executable_content": false,
        "contains_credentials_or_session_data": false,
        "source_notes": "Instructions and metadata are Apache-2.0, but each task instance retains its original source dataset license."
      },
      "reviews": {
        "legal": null,
        "provenance": null,
        "privacy": null,
        "security": null,
        "generation_terms": null
      },
      "artifacts": [],
      "status": "candidate"
    },
    {
      "priority": 3,
      "dataset_id": "helpsteer2",
      "display_name": "HelpSteer2",
      "purpose": "preference_and_quality",
      "source_url": "https://huggingface.co/datasets/nvidia/HelpSteer2",
      "source_revision": "unresolved",
      "intended_uses": [
        "evaluation",
        "reward_modeling"
      ],
      "license": {
        "declared_spdx_expression": "CC-BY-4.0",
        "scope": "dataset_wide",
        "evidence_url": "https://huggingface.co/datasets/nvidia/HelpSteer2/blob/main/README.md",
        "evidence_revision": "unresolved",
        "requires_attribution": true,
        "requires_share_alike": false,
        "attribution_plan_hash": null,
        "share_alike_plan_hash": null,
        "component_license_inventory_hash": null
      },
      "risk": {
        "contains_user_content": true,
        "contains_model_generated_content": true,
        "generation_system": "NVIDIA in-house language models",
        "requires_personal_data_review": true,
        "contains_sensitive_safety_content": false,
        "contains_third_party_content": false,
        "contains_executable_content": false,
        "contains_credentials_or_session_data": false,
        "source_notes": "Prompts are mostly user-contributed ShareGPT prompts and responses were generated by multiple in-house models."
      },
      "reviews": {
        "legal": null,
        "provenance": null,
        "privacy": null,
        "security": null,
        "generation_terms": null
      },
      "artifacts": [],
      "status": "candidate"
    },
    {
      "priority": 4,
      "dataset_id": "koalpaca-realqa",
      "display_name": "KoAlpaca-RealQA",
      "purpose": "korean_instruction",
      "source_url": "https://huggingface.co/datasets/beomi/KoAlpaca-RealQA",
      "source_revision": "unresolved",
      "intended_uses": [
        "evaluation",
        "supervised_fine_tuning"
      ],
      "license": {
        "declared_spdx_expression": "CC-BY-SA-4.0",
        "scope": "dataset_wide",
        "evidence_url": "https://huggingface.co/datasets/beomi/KoAlpaca-RealQA/blob/main/README.md",
        "evidence_revision": "unresolved",
        "requires_attribution": true,
        "requires_share_alike": true,
        "attribution_plan_hash": null,
        "share_alike_plan_hash": null,
        "component_license_inventory_hash": null
      },
      "risk": {
        "contains_user_content": true,
        "contains_model_generated_content": true,
        "generation_system": "OpenAI gpt-4o-2024-08-06",
        "requires_personal_data_review": true,
        "contains_sensitive_safety_content": false,
        "contains_third_party_content": false,
        "contains_executable_content": false,
        "contains_credentials_or_session_data": false,
        "source_notes": "Questions came from real ChatKoAlpaca interactions and answers were generated by GPT-4o."
      },
      "reviews": {
        "legal": null,
        "provenance": null,
        "privacy": null,
        "security": null,
        "generation_terms": null
      },
      "artifacts": [],
      "status": "candidate"
    },
    {
      "priority": 5,
      "dataset_id": "gorilla-apibench",
      "display_name": "Gorilla APIBench",
      "purpose": "api_calling",
      "source_url": "https://github.com/ShishirPatil/gorilla/tree/main/data/apibench",
      "source_revision": "unresolved",
      "intended_uses": [
        "evaluation",
        "supervised_fine_tuning"
      ],
      "license": {
        "declared_spdx_expression": "NOASSERTION",
        "scope": "component_specific",
        "evidence_url": "https://github.com/ShishirPatil/gorilla/blob/main/LICENSE",
        "evidence_revision": "unresolved",
        "requires_attribution": true,
        "requires_share_alike": false,
        "attribution_plan_hash": null,
        "share_alike_plan_hash": null,
        "component_license_inventory_hash": null
      },
      "risk": {
        "contains_user_content": false,
        "contains_model_generated_content": true,
        "generation_system": "Gorilla Self-Instruct APIBench generation pipeline",
        "requires_personal_data_review": false,
        "contains_sensitive_safety_content": false,
        "contains_third_party_content": true,
        "contains_executable_content": true,
        "contains_credentials_or_session_data": false,
        "source_notes": "The repository is Apache-2.0, while APIBench incorporates documentation from Hugging Face, Torch Hub, and TensorFlow Hub APIs that require component review."
      },
      "reviews": {
        "legal": null,
        "provenance": null,
        "privacy": null,
        "security": null,
        "generation_terms": null
      },
      "artifacts": [],
      "status": "candidate"
    },
    {
      "priority": 6,
      "dataset_id": "aegis-2",
      "display_name": "Aegis AI Content Safety Dataset 2.0",
      "purpose": "safety_classification",
      "source_url": "https://huggingface.co/datasets/nvidia/Aegis-AI-Content-Safety-Dataset-2.0",
      "source_revision": "unresolved",
      "intended_uses": [
        "evaluation",
        "safety_classification"
      ],
      "license": {
        "declared_spdx_expression": "CC-BY-4.0",
        "scope": "dataset_wide",
        "evidence_url": "https://huggingface.co/datasets/nvidia/Aegis-AI-Content-Safety-Dataset-2.0/blob/main/README.md",
        "evidence_revision": "unresolved",
        "requires_attribution": true,
        "requires_share_alike": false,
        "attribution_plan_hash": null,
        "share_alike_plan_hash": null,
        "component_license_inventory_hash": null
      },
      "risk": {
        "contains_user_content": true,
        "contains_model_generated_content": true,
        "generation_system": "Mistral, Mixtral, Gemma, and NVIDIA hybrid human-LLM annotation pipeline",
        "requires_personal_data_review": true,
        "contains_sensitive_safety_content": true,
        "contains_third_party_content": false,
        "contains_executable_content": false,
        "contains_credentials_or_session_data": false,
        "source_notes": "Contains harmful or upsetting safety content, human prompts from multiple sources, synthetic responses, and LLM-generated labels."
      },
      "reviews": {
        "legal": null,
        "provenance": null,
        "privacy": null,
        "security": null,
        "generation_terms": null
      },
      "artifacts": [],
      "status": "candidate"
    }
  ]
}
